9780375706851,"PAMUK, ORHAN",MY NAME IS RED,RANDOM HOUSE,,R,$15.95
9780385264761,MAHFOUZ,MIDAQ ALLEY (P),DOUBLEDAY,,R,$15.00
9780802131805,"HEDAYAT, SADEGH",BLIND OWL,GROVE/ATLANTIC,,R,$14.00
9780894102011,SALIH,WEDDING OF ZEIN,"LYNNE RIENNER PUBS, INC",1,R,$13.95
9781559707657,"MOZAFFARI, NAHID","STRANGE TIMES, MY DEAR: THE PEN ANTHOLOGY OF CONTEMPORARY IRANIAN LITERATURE",HACHETTE BOOK GROUP,,R,$27.50
9781592642540,"AGNON, S. Y.",A BOOK THAT WAS LOST: THIRTY-FIVE STORIES,THE TOBY PRESS LLC,,R,$14.95
9789774247804,"JOHNSON-DAVIES, DENYS",UNDER THE NAKED SKY: SHORT STORIES FROM THE ARAB WORLD,INTERNATIONAL PUB MARKETING,,R,$16.95
