281088091529B,ADA,IDNT REFERENCE MANUAL,ACADEMY OF NUTRITION & DIETETICS,4,R,$97.75
9780323052917,MOSBY,MOSBY'S POCKET DICTIONARY OF MEDICINE ETC,ELSEVIER SCI PUBL CO INC,6,O,$39.95
9780495554769,NELMS,MEDICAL NUTRITION THERAPY,CENGAGE,3,R,$112.00
9780880913775,ADA,CHOOSE YOUR FOOD: EXCHANGE LISTS FOR MEAL PLANNING (P),ACADEMY OF NUTRITION & DIETETICS,2,R,$4.00
9780880914000,RENAL DIETITIANS DIETETIC PRACTICE GROUP,NATIONAL RENAL DIET: PROFESSIONAL GUIDE (ITEM #4009),ACADEMY OF NUTRITION & DIETETICS,2,R,$30.00
9780880914017,AMERICAN DIETETIC ASSOCIATION,A HEALTHY FOOD GUIDE FOR PEOPLE W/ CHRONIC KIDNEY DISEASE: NATIONAL RENAL DIET CLIENT EDUCATION GUIDE,ACADEMY OF NUTRITION & DIETETICS,2,R,$5.00
9780971089655,PRONSKY,FOOD MEDICATION INTERACTIONS HANDBOOK,FOOD MEDICATION INTERACTIONS,17,R,$33.95
9781437722338,"MAHAN, L. KATHLEEN",KRAUSE'S FOOD & THE NUTRITION CARE PROCESS,ELSEVIER SCI PUBL CO INC,13,R,$140.00
