9780060892005,COLLINS,COLLINS ROBERT FRENCH COLLEGE DICTIONARY,HARPERCOLLINS PUBLISHERS,5,O,$29.95
9780205628483,ROCHAT,WKBK CONTRASTES: GRAMMAIRE ETC,ALLYN & BACON INC.,2,O,$39.25
9780205646999,ROCHAT,CONTRASTES: GRAMMAIRE ETC,ALLYN & BACON INC.,2,R,$60.00
9780205647491,PEARSON,MY FRENCH LAB ACCESS,ALLYN & BACON INC.,,O,$153.25
9780819187376,GENO,CLEF : LA FRANCAISE : CORRECT FRENCH FOR ENGL SPEAKERS,UNIVERSITY PRESS OF AMERICA,,O,$55.99
9780838455333,BAKER/CAUVIN,PANACHE LITTERAIRE,CENGAGE,3,O,$165.00
