9782070416134,GENET,PARAVENTS (GALLIMARD/FOLIO),IDEAL FOREIGN BOOKS,,R,$19.95
9782070737246,D'AUBIGNE,LES TRAGIQUES,IDEAL FOREIGN BOOKS,,R,$28.95
9782253066781,JOINVILLE,VIE DE SAINT LOUIS,IDEAL FOREIGN BOOKS,,R,$28.95
9782290119167,MAALOUF,CROISADES VUES PAR LES ARABES,IDEAL FOREIGN BOOKS,,R,$14.95
9782707142818,FANON,LES DAMNES DE LA TERRE (LA DECOUVERTE #134),IDEAL FOREIGN BOOKS,,R,$24.95
9782707302908,DELBO,AUSCHWITZ ET APRES. TOME 1 : AUCUN DE NOUS NE REVIENDRA,IDEAL FOREIGN BOOKS,,R,$22.95
9782707304025,DELBO,AUSCHWITZ ET APRES T.2 ; UNE CONNAISSANCE INUTILE,IDEAL FOREIGN BOOKS,,R,$29.95
9782818502068,GIRARD,LA VIOLENCE ET LE SACRE,IDEAL FOREIGN BOOKS,,R,$24.95
